{
  "schema_version": "1.0.0",
  "snapshot_at": "2026-07-11",
  "default_mutation_mode": "read-only",
  "platforms": [
    {
      "id": "google",
      "display_name": "Google Ads",
      "target_tier": "first-class",
      "skill_path": "skills/ads-google/SKILL.md",
      "capabilities": [
        {"id": "skill-guidance", "mode": "export-read", "status": "implemented", "implementation_paths": ["skills/ads-google/SKILL.md"], "fixture_paths": [], "test_paths": [], "source_ids": ["claude-ads-v181-tree", "google-ads-api-official"]},
        {"id": "export-ingestion", "mode": "export-read", "status": "fixture-verified", "implementation_paths": ["claude_ads_core/adapters/csv_export.py"], "fixture_paths": ["tests/fixtures/exports/google.csv"], "test_paths": ["tests/core/test_adapters.py"], "source_ids": ["claude-ads-v2-export-adapter", "google-ads-api-official"]},
        {"id": "native-export-normalization", "mode": "export-read", "status": "fixture-verified", "implementation_paths": ["claude_ads_core/adapters/mappings_v1.py", "claude_ads_core/adapters/native_export.py"], "fixture_paths": ["tests/fixtures/native_exports/google.csv"], "test_paths": ["tests/core/test_native_exports.py"], "source_ids": ["google-ads-campaign-fields-official"]},
        {"id": "account-health-scoring", "mode": "export-read", "status": "disabled", "implementation_paths": ["claude_ads_core/control_registry.py", "control-plane/manifests/control-registry.json", "control-plane/manifests/scoring-profiles.json"], "fixture_paths": [], "test_paths": ["tests/core/test_control_registry.py", "tests/core/test_platform_report_contracts.py"], "source_ids": [], "disabled_reason": "No approved source-grounded control-severity decision set; discovery findings remain unscored."},
        {"id": "account-mutation", "mode": "live-write", "status": "disabled", "implementation_paths": [], "fixture_paths": [], "test_paths": [], "source_ids": [], "disabled_reason": "No approved v2 write adapter lifecycle."}
      ]
    },
    {
      "id": "meta",
      "display_name": "Meta Ads",
      "target_tier": "first-class",
      "skill_path": "skills/ads-meta/SKILL.md",
      "capabilities": [
        {"id": "skill-guidance", "mode": "export-read", "status": "implemented", "implementation_paths": ["skills/ads-meta/SKILL.md"], "fixture_paths": [], "test_paths": [], "source_ids": ["claude-ads-v181-tree", "meta-marketing-api-official"]},
        {"id": "export-ingestion", "mode": "export-read", "status": "fixture-verified", "implementation_paths": ["claude_ads_core/adapters/csv_export.py"], "fixture_paths": ["tests/fixtures/exports/meta.csv"], "test_paths": ["tests/core/test_adapters.py"], "source_ids": ["claude-ads-v2-export-adapter", "meta-marketing-api-official"]},
        {"id": "native-export-normalization", "mode": "export-read", "status": "fixture-verified", "implementation_paths": ["claude_ads_core/adapters/mappings_v1.py", "claude_ads_core/adapters/native_export.py"], "fixture_paths": ["tests/fixtures/native_exports/meta.csv"], "test_paths": ["tests/core/test_native_exports.py"], "source_ids": ["meta-insights-reporting-official"]},
        {"id": "account-health-scoring", "mode": "export-read", "status": "disabled", "implementation_paths": ["claude_ads_core/control_registry.py", "control-plane/manifests/control-registry.json", "control-plane/manifests/scoring-profiles.json"], "fixture_paths": [], "test_paths": ["tests/core/test_control_registry.py", "tests/core/test_platform_report_contracts.py"], "source_ids": [], "disabled_reason": "No approved source-grounded control-severity decision set; discovery findings remain unscored."},
        {"id": "account-mutation", "mode": "live-write", "status": "disabled", "implementation_paths": [], "fixture_paths": [], "test_paths": [], "source_ids": [], "disabled_reason": "No approved v2 write adapter lifecycle."}
      ]
    },
    {
      "id": "youtube",
      "display_name": "YouTube Ads",
      "target_tier": "first-class",
      "skill_path": "skills/ads-youtube/SKILL.md",
      "capabilities": [
        {"id": "skill-guidance", "mode": "export-read", "status": "implemented", "implementation_paths": ["skills/ads-youtube/SKILL.md"], "fixture_paths": [], "test_paths": [], "source_ids": ["claude-ads-v181-tree", "youtube-google-ads-video-official"]},
        {"id": "export-ingestion", "mode": "export-read", "status": "fixture-verified", "implementation_paths": ["claude_ads_core/adapters/csv_export.py"], "fixture_paths": ["tests/fixtures/exports/youtube.csv"], "test_paths": ["tests/core/test_adapters.py"], "source_ids": ["claude-ads-v2-export-adapter", "youtube-google-ads-video-official"]},
        {"id": "native-export-normalization", "mode": "export-read", "status": "fixture-verified", "implementation_paths": ["claude_ads_core/adapters/mappings_v1.py", "claude_ads_core/adapters/native_export.py"], "fixture_paths": ["tests/fixtures/native_exports/youtube.csv"], "test_paths": ["tests/core/test_native_exports.py"], "source_ids": ["google-ads-campaign-fields-official", "youtube-google-ads-video-official"]},
        {"id": "account-health-scoring", "mode": "export-read", "status": "disabled", "implementation_paths": ["claude_ads_core/control_registry.py", "control-plane/manifests/control-registry.json", "control-plane/manifests/scoring-profiles.json"], "fixture_paths": [], "test_paths": ["tests/core/test_control_registry.py", "tests/core/test_platform_report_contracts.py"], "source_ids": [], "disabled_reason": "No approved source-grounded control-severity decision set; discovery findings remain unscored."},
        {"id": "account-mutation", "mode": "live-write", "status": "disabled", "implementation_paths": [], "fixture_paths": [], "test_paths": [], "source_ids": [], "disabled_reason": "No approved v2 write adapter lifecycle."}
      ]
    },
    {
      "id": "linkedin",
      "display_name": "LinkedIn Ads",
      "target_tier": "first-class",
      "skill_path": "skills/ads-linkedin/SKILL.md",
      "capabilities": [
        {"id": "skill-guidance", "mode": "export-read", "status": "implemented", "implementation_paths": ["skills/ads-linkedin/SKILL.md"], "fixture_paths": [], "test_paths": [], "source_ids": ["claude-ads-v181-tree", "linkedin-marketing-api-official"]},
        {"id": "export-ingestion", "mode": "export-read", "status": "fixture-verified", "implementation_paths": ["claude_ads_core/adapters/csv_export.py"], "fixture_paths": ["tests/fixtures/exports/linkedin.csv"], "test_paths": ["tests/core/test_adapters.py"], "source_ids": ["claude-ads-v2-export-adapter", "linkedin-marketing-api-official"]},
        {"id": "native-export-normalization", "mode": "export-read", "status": "fixture-verified", "implementation_paths": ["claude_ads_core/adapters/mappings_v1.py", "claude_ads_core/adapters/native_export.py"], "fixture_paths": ["tests/fixtures/native_exports/linkedin.csv"], "test_paths": ["tests/core/test_native_exports.py"], "source_ids": ["linkedin-ad-analytics-reporting-official"]},
        {"id": "account-health-scoring", "mode": "export-read", "status": "disabled", "implementation_paths": ["claude_ads_core/control_registry.py", "control-plane/manifests/control-registry.json", "control-plane/manifests/scoring-profiles.json"], "fixture_paths": [], "test_paths": ["tests/core/test_control_registry.py", "tests/core/test_platform_report_contracts.py"], "source_ids": [], "disabled_reason": "No approved source-grounded control-severity decision set; discovery findings remain unscored."},
        {"id": "account-mutation", "mode": "live-write", "status": "disabled", "implementation_paths": [], "fixture_paths": [], "test_paths": [], "source_ids": [], "disabled_reason": "No approved v2 write adapter lifecycle."}
      ]
    },
    {
      "id": "tiktok",
      "display_name": "TikTok Ads",
      "target_tier": "first-class",
      "skill_path": "skills/ads-tiktok/SKILL.md",
      "capabilities": [
        {"id": "skill-guidance", "mode": "export-read", "status": "implemented", "implementation_paths": ["skills/ads-tiktok/SKILL.md"], "fixture_paths": [], "test_paths": [], "source_ids": ["claude-ads-v181-tree", "tiktok-business-api-official"]},
        {"id": "export-ingestion", "mode": "export-read", "status": "fixture-verified", "implementation_paths": ["claude_ads_core/adapters/csv_export.py"], "fixture_paths": ["tests/fixtures/exports/tiktok.csv"], "test_paths": ["tests/core/test_adapters.py"], "source_ids": ["claude-ads-v2-export-adapter", "tiktok-business-api-official"]},
        {"id": "native-export-normalization", "mode": "export-read", "status": "fixture-verified", "implementation_paths": ["claude_ads_core/adapters/mappings_v1.py", "claude_ads_core/adapters/native_export.py"], "fixture_paths": ["tests/fixtures/native_exports/tiktok.csv"], "test_paths": ["tests/core/test_native_exports.py"], "source_ids": ["tiktok-integrated-reporting-official"]},
        {"id": "account-health-scoring", "mode": "export-read", "status": "disabled", "implementation_paths": ["claude_ads_core/control_registry.py", "control-plane/manifests/control-registry.json", "control-plane/manifests/scoring-profiles.json"], "fixture_paths": [], "test_paths": ["tests/core/test_control_registry.py", "tests/core/test_platform_report_contracts.py"], "source_ids": [], "disabled_reason": "No approved source-grounded control-severity decision set; discovery findings remain unscored."},
        {"id": "account-mutation", "mode": "live-write", "status": "disabled", "implementation_paths": [], "fixture_paths": [], "test_paths": [], "source_ids": [], "disabled_reason": "No approved v2 write adapter lifecycle."}
      ]
    },
    {
      "id": "microsoft",
      "display_name": "Microsoft Advertising",
      "target_tier": "first-class",
      "skill_path": "skills/ads-microsoft/SKILL.md",
      "capabilities": [